,date,title,source,link
432,8/5/2020,Jon Johnson – Buy American and Economic Relations with Canada,CD_Howe,https://www.cdhowe.org/intelligence-memos/jon-johnson-%E2%80%93-buy-american-and-economic-relations-canada
433,8/4/2020,Edmonton-based Stantec leading global research project to digitally transform water utility companies,Edmonton_Journal,na
434,8/4/2020,"Alberta, Ottawa sign deal that reduces oilsands environmental monitoring",Calgary_Herald,na
435,8/4/2020,Oil falls as rising virus cases overshadow demand recovery,Calgary_Herald,na
436,8/4/2020,Market movers: Stocks seeing action on Tuesday - and why,Globe,na
437,8/4/2020,CI Financial buys minority stake in U.S.-based wealth manager Congress as international expansion continues,Globe,na
438,8/4/2020,Canadian farmers plant far more durum as COVID-19 pushes global demand sky high,Globe,na
439,8/4/2020,"Ottawa offers cash, more promises of reform for migrant workers in the agriculture industry",Globe,na
440,8/4/2020,"Lack of bees, pollination limiting yields for certain crops on B.C. and U.S. farms: study",Globe,na
441,8/4/2020,"Migrant workers on farms across Canada are being told they can’t leave, raising rights concerns",Globe,na
442,8/4/2020,"Clorox won’t have enough disinfecting wipes until 2021, CEO Benno Dorer says",Globe,na
443,8/4/2020,"U.S. border communities feel loss of Canadian tourists, shoppers and friends",Globe,na
444,8/4/2020,"As hundreds of stores shut down, retail landlords cut rents in bid to help struggling companies survive ",Globe,na
445,8/4/2020,Potential Tiktok-Microsoft deal threatens to ramp up tensions between U.S. and China,Globe,na
446,8/4/2020,"Ottawa’s hydrogen strategy must overcome challenges of high costs, lack of industry standards",Globe,na
447,8/4/2020,HSBC warns loan losses could hit $13-billion as profit plunges 65%,Globe,na
448,8/4/2020,Hiring a Black leader? Learn from my experience and treat it like it matters ,Globe,na
449,8/4/2020,"Before Canada bets big on hydrogen, or other clean technologies, it’s gut check time ",Globe,na
450,8/4/2020,Decades of progress on gender equality in the workplace at risk of vanishing,Globe,na
451,8/4/2020,How the COVID-19 pandemic may sabotage retirement for boomers and Gen X,Globe,na
452,8/4/2020,‘Opportunity widens’ in Canadian REIT sector: Analyst,Globe,na
453,8/4/2020,Future proofing: Upgrade fading offices or convert them to residential?,Globe,na
454,8/4/2020,U.K. tech investment fund chooses Canada for North American headquarters,Globe,na
455,8/4/2020,A Q&A with David Rosenberg: Pandemic economy calls for discipline and patience,Globe,na
456,8/4/2020,"Halifax startup Groundhog sues U.S. company, claiming it stole trade secrets",Globe,na
457,8/4/2020,CI Financial’s U.S. wealth business to grow by 70 per cent with acquisition of Illinois based BDF,Globe,na
458,8/4/2020,BMO signs deal to offer digital chequing accounts in U.S. through Google Pay,Globe,na
459,8/4/2020,"Pandemic-fuelled oil crash hastens Europe’s flight, but oil sands are resilient ",Globe,na
460,8/4/2020,Husky targets 25% emissions cut by 2025,Globe,na
461,8/4/2020,Alberta and Ottawa sign deal that reduces oil sands environmental monitoring ,Globe,na
462,8/4/2020,"BP halves dividend after record loss, speeds up reinvention",Globe,na
463,8/4/2020,Canadian dollar weakens as investors weigh rising U.S.-China tensions,Globe,na
464,8/4/2020,"Booking.com plans to reduce 25% of its 17,000 work force due to pandemic",Globe,na
465,8/4/2020,Argentina strikes $65-billion debt deal with three creditor groups to break impasse,Globe,na
466,8/4/2020,Google’s $2.1-billion Fitbit deal hits roadblock as EU antitrust regulators open investigation,Globe,na
467,8/4/2020,Google unveils its first 5G-enabled phones,Globe,na
468,8/4/2020,China’s Bytedance says it is looking at relocating TikTok’s headquarters,Globe,na
469,8/4/2020,"N.S. government sells Liscombe Lodge resort to private operator for $450,000",Globe,na
470,8/4/2020,"Hotels group Accor to cut 1,000 jobs after coronavirus loss",Globe,na
471,8/4/2020,Apple says it has no interest in buying TikTok,Globe,na
472,8/4/2020,Germany’s BaFin audits Wirecard accounts from 2017 to 2019,Globe,na
473,8/4/2020,"Porter again delays restart date, aims to resume flights in October",Globe,na
474,8/4/2020,Motor vehicles power U.S. factory orders in June,Globe,na
475,8/4/2020,Spirit AeroSystems posts bigger-than-expected loss as coronavirus hits aero parts demand,Globe,na
476,8/4/2020,Canadian factory activity resumes expansion in July as economy reopens,Globe,na
477,8/4/2020,Tesla slashes Model Y price amid pandemic,Globe,na
478,8/4/2020,Star Wars inspires new smart-skin technology,Globe,na
479,8/4/2020,Dragon to the rescue: Michele Romanow and partner launch new venture to source PPE during pandemic,Globe,na
480,8/4/2020,Holograms take virtual meetings to new levels,Globe,na
481,8/4/2020,Former BMO CEO Tony Comper revamps charity focused on anti-Semitism,Globe,na
482,8/4/2020,Calfrac investor Wilks Brothers launches rival restructuring deal,Globe,na
483,8/4/2020,Amazon starts preparations to launch in Sweden,Globe,na
484,8/4/2020,Ford CEO Jim Hackett to retire; COO Jim Farley to take over,Globe,na
485,8/4/2020,"Artificial intelligence isn’t destroying jobs, it’s making them more inclusive",Globe,na
486,8/4/2020,Sustaining a ‘work from anywhere’ culture post-pandemic,Globe,na
487,8/4/2020,Should I meet with my employer’s competitor to see what they can offer me?,Globe,na
488,8/4/2020,"Lord & Taylor, oldest U.S. department store, goes bankrupt",National_Post,https://financialpost.com/news/retail-marketing/lord-taylor-oldest-u-s-department-store-goes-bankrupt/wcm/ff1564b0-5ff3-442d-a9f3-69bbcd0274ee/
489,8/4/2020,Food suppliers feeling pinched as grocers hike fees,National_Post,https://financialpost.com/news/retail-marketing/one-sided-relationship-food-suppliers-feeling-pinched-as-grocers-hike-fees/wcm/c189acb1-9992-49f6-a8f8-c96111bd0f12/
490,8/4/2020,Has Warren Buffett lost his touch?,National_Post,https://financialpost.com/investing/investing-pro/has-warren-buffett-lost-his-touch/wcm/778dab0f-33d6-4cb8-b673-c861a9a1d381/
491,8/4/2020,"Bytes over bits: How the drilling industry is turning to algos, automation and software to cut costs",National_Post,https://financialpost.com/news/bytes-over-bits-how-the-drilling-industry-is-turning-to-algorithms-automation-and-software-to-cut-costs/wcm/3f32d527-1bcf-45e3-b1f3-f62f441a5154/
492,8/4/2020,Does it make sense for Microsoft to buy TikTok's U.S. arm?,National_Post,https://financialpost.com
493,8/4/2020,Tech titans in the hot seat as tactics likened to railway cartels of old,National_Post,https://financialpost.com
494,8/4/2020,COVID-19 is forcing people to take stock of their lives — and their financial goals are changing in the process,National_Post,https://financialpost.com
495,8/4/2020,Next Premier of Newfoundland and Labrador aims to pull province off ‘well-worn path of boom and bust’,National_Post,https://financialpost.com
496,8/4/2020,"Posthaste: With eviction notices looming for 28 million Americans, the U.S. economy needs another shot in the arm — and fast",National_Post,https://financialpost.com
497,8/4/2020,Wilks Brothers swoop in with competing offer for Calfrac; says management deal favours insiders,National_Post,https://financialpost.com
498,8/4/2020,"7-Eleven owner beats out Couche-Tard with $21 billion deal for 3,900 Speedway outlets",National_Post,https://financialpost.com
499,8/4/2020,Is the endgame near for oil?,National_Post,https://financialpost.com
500,8/4/2020,What Role Does the Housing Market Play in Sustaining Canada’s Financial Stability?,CD_Howe,https://www.cdhowe.org/essential-public-policy-events/what-role-does-housing-market-play-sustaining-canada%E2%80%99s-financial-stability
501,8/4/2020,"Knubley, Hunter – Three Principles for Tougher Foreign Takeover Reviews",CD_Howe,https://www.cdhowe.org/intelligence-memos/knubley-hunter-%E2%80%93-three-principles-tougher-foreign-takeover-reviews
502,7/29/2020,Want a more diverse work force? Move beyond inclusion to belonging,Globe,
503,7/29/2020,Big Tech can’t keep rising when the economy is sinking ,Globe,
504,7/29/2020,Office politics: Why worthy adversaries are as valuable as friends,Globe,
505,7/29/2020,What record high gold prices mean for mining companies in Canada — podcast,National_Post,
506,7/29/2020,Here’s a way Canadians with RRSP savings can get the most out of their CPP benefits,Globe,
507,7/29/2020,Oil lobby group wants changes to federal support programs ,Globe,
508,7/29/2020,Walmart to impose new fees on suppliers to offset $3.5-billion investment in Canada,Globe,
509,7/29/2020,HSBC accused of co-operating with U.S. in arrest of Huawei’s Meng on Beijing-backed website,Globe,
510,7/29/2020,Canada risks trade spat with Japan over restrictions on log exports,Globe,
511,7/29/2020,Market movers: Stocks that saw action on Wednesday - and why,Globe,
512,7/29/2020,Sun Life invests in booming telehealth provider Dialogue,Globe,
513,7/29/2020,Rival bidder tries to halt court approval of Torstar takeover by Nordstar ,Globe,
514,7/29/2020,London expects only half of bankers back at their desks this year,Globe,
515,7/29/2020,Former WE Charity board chair says she had little insight into finances,Globe,
516,7/29/2020,"Enbridge beats profit estimates, sees improving Mainline throughput",Calgary_Herald,
517,7/29/2020,Varcoe: Deutsche Bank move to stop oilsands financing sparks pushback in Alberta,Calgary_Herald,
518,7/29/2020,Calgary-based Swimco in creditor protection as COVID-19's economic toll continues,Calgary_Herald,
519,7/29/2020,The close: TSX jumps as Shopify surges; Wall Street adds to gains after Fed vows more support,Globe,
520,7/29/2020,Moderna plans to price COVID-19 vaccine to ensure broad access,Globe,
521,7/29/2020,Shopify’s revenue doubles as COVID-19 sparks boom in online retail,Globe,
522,7/29/2020,Cannabis-producer Aphria shares plunge on larger-than-expected loss,Globe,
523,7/29/2020,North Dakota pipeline doubts put Bakken shale field reboot on hold,Globe,
524,7/29/2020,‘There is no going back’: Federal review panel calls on Canada to endorse open banking,Globe,
525,7/29/2020,"France’s Total writes down $8-billion on weaker oil, gas outlook",Globe,
526,7/29/2020,EU watchdog tells banks to prepare for full Brexit,Globe,
527,7/29/2020,U.S. crude stocks see steepest weekly draw of 2020 as imports decrease,Globe,
528,7/29/2020,"Jeff Bezos, Mark Zuckerberg and Elon Musk have made $115 billion this year",National_Post,
529,7/29/2020,TikTok CEO argues U.S. needs the Chinese app to spur social-media competition,Globe,
530,7/29/2020,GM says it should be able to pay off $16-billion loan by end of 2020 if U.S. recovery continues,Globe,
531,7/29/2020,Boeing to cut 787 and 777 production as coronavirus hammers sales,Globe,
532,7/29/2020,"Class of 2020 could lose $25,000 in potential earnings owing to COVID-19, study finds",Globe,
533,7/29/2020,Gwyn Morgan: Ill-conceived WE program wasn't even needed in the first place,National_Post,
534,7/29/2020,Equitable Bank says mortgage deferrals have plummeted from their peak,National_Post,
535,7/29/2020,'Painful' process: RioCan CEO critical of Ottawa's rent assistance program as retail landlord suffers $350M loss,National_Post,
536,7/29/2020,Fed holds zero rates as Powell warns virus spike hitting economy,National_Post,
537,7/29/2020,"Total takes $7-billion writedown on oilsands projects, labels Fort Hills, Surmont as 'stranded' assets",National_Post,
538,7/29/2020,Most TD staff to work from home until the end of 2020 and possibly into 2021,National_Post,
539,7/29/2020,"Gold is surging, but silver could go ‘parabolic’ as precious metal ratio narrows",National_Post,
540,7/29/2020,Jack M. Mintz: We don't need higher taxes to slay government debt,National_Post,
541,7/29/2020,Enbridge CEO doesn't see major problems dealing with potential Biden administration,National_Post,
542,7/29/2020,Ottawa announces cellphone tracker to see if companies are cutting prices,Globe,
543,7/29/2020,Bird Construction acquiring Stuart Olson in $96.5-million deal,Globe,
544,7/29/2020,Federal Reserve’s Powell says coronavirus surge starting to weigh on economic recovery,Globe,
545,7/29/2020,Canadian dollar gains as investors sell greenbacks on ‘downbeat’ Fed,Globe,
546,7/29/2020,"U.S. housing market pushes ahead, trade flows improve",Globe,
547,7/29/2020,"Qualcomm forecasts sales above estimates, resolves licensing dispute with Huawei",Globe,
548,7/29/2020,Rare pause in tech appetite suggests some indigestion,Globe,
549,7/29/2020,Spotify misses revenue expectations as coronavirus deters advertisers,Globe,
550,7/29/2020,PayPal profit jumps 86% on pandemic-driven online spending shift,Globe,
551,7/29/2020,Henry’s gets court approval to restructure family owned camera retail chain,Globe,
552,7/29/2020,Privacy officials say LifeLabs has asked court to limit their breach report ,Globe,
553,7/29/2020,WTO set to skip naming acting director-general after U.S. push caused deadlock,Globe,
554,7/29/2020,"CEOs of Apple, Amazon, Google and Facebook getting heat from U.S. Congress on competition",Globe,
555,7/29/2020,Is this the end game for oil?,Globe,
556,7/29/2020,RioCan posts net loss of $350.8-million as tenants defer rent due to COVID-19,Globe,
557,7/29/2020,"Why gold is rallying. Plus, bargain dividend stocks and tools for timing the market",Globe,
558,7/28/2020,Edmonton’s first Black-owned market ready to open Sunday,Edmonton_Journal,
559,7/28/2020,RBC to raise $1.75-billion with new tax-efficient security ,Globe,
560,7/28/2020,Seven ways to spot a terrible boss (before you take the job),Globe,
561,7/28/2020,"‘America First’ means America alone – and in a postpandemic world, that would be disastrous",Globe,
562,7/28/2020,Could a federal recovery plan address both climate change and the ‘she-cession'?,Globe,
563,7/28/2020,You call this an economic recovery?,Globe,
564,7/28/2020,New recovery package and strong pandemic response set EU apart from Donald Trump’s America,Globe,
565,7/28/2020,Left behind by the market rally? Banks top this list of 10 dividend stocks that could still be a bargain ,Globe,
566,7/28/2020,How the pandemic could cost you some of your CPP retirement benefits,Globe,
567,7/28/2020,New condo sales in GTA in second quarter drop to lowest level since Great Recession ,Globe,
568,7/28/2020,"As gold hits all-time high, Canadian miners step back from its glare",Globe,
569,7/28/2020,Vancouver COVID-19 therapy developer AbCellera eyeing potential IPO as early as fall,Globe,
570,7/28/2020,Diversity experts urge financial firms to set specific staffing targets,Globe,
571,7/28/2020,Big Tech firms to testify Wednesday before U.S. Congress on antitrust,Globe,
572,7/28/2020,Robust corporate bond market has little need of BoC support program,Globe,
573,7/28/2020,Bank of Ireland fined €1.7-million over handling of online fraud case,Globe,
574,7/28/2020,HSBC aims to double number of senior Black staff by 2025: memo,Globe,
575,7/28/2020,Oil sands production expected to rebound after COVID-linked 2020 slump,Globe,
576,7/28/2020,Oil falls as U.S. fiscal package faces tough talks,Globe,
577,7/28/2020,"Boosting marginalized groups key to ‘feminist economic recovery,’ report says",Globe,
578,7/28/2020,Rising COVID-19 cases dent U.S. consumer confidence; housing market presses ahead,Globe,
579,7/28/2020,Canadian dollar’s advance stalls as oil prices decline,Globe,
580,7/28/2020,Facebook gets temporary reprieve from EU data requests in antitrust probe,Globe,
581,7/28/2020,Tired of working from home? Try a hotel room,Globe,
582,7/28/2020,"Once Canada’s oil relief valve, rail shipping grinds to near halt",Globe,
583,7/28/2020,'A light at the end of the tunnel': Beef industry recovering from COVID-19 impact,Edmonton_Journal,
584,7/28/2020,Credit agency says Edmonton airport passenger levels will take four years to return to pre-COVID-19 levels,Edmonton_Journal,
585,7/28/2020,Alberta powers up hydrogen sector with three small-scale projects as part of plan to reduce emissions,Edmonton_Journal,
586,7/28/2020,Solar power with a difference as ITER nuclear fusion assembly starts,Calgary_Herald,
587,7/28/2020,The close: Resource stocks weigh on TSX,Globe,
588,7/28/2020,Royal Bank cuts ties with beleaguered WE Charity,Globe,
589,7/28/2020,WE Charity ex-chair says she resigned over lack of financial disclosure during mass layoffs,Globe,
590,7/28/2020,"Virgin suspends WE Charity donations, Telus drops partnership, as sponsors review ties ",Globe,
591,7/28/2020,Judge approves NordStar’s $60-million takeover of Torstar,Globe,
592,7/28/2020,The fall of Canada’s razzle-dazzle paper. Can it find glory again?,Globe,
593,7/28/2020,The Torstar sale will have a lasting impact on Canada,Globe,
594,7/28/2020,New university graduates face poor prospects in tough job market,Globe,
595,7/28/2020,2020 vs. 2012 vs. 1984: Young adults have it harder than ever today,Globe,
596,7/28/2020,Scotiabank allows most staff to work remotely until 2021 ,Globe,
597,7/28/2020,George Weston posts $255-million loss as coronavirus-related costs pile up,Globe,
598,7/28/2020,"Sexism, racism at heart of female roofer’s $100,000 victory in federal tax court",Globe,
599,7/28/2020,Vacation properties see spike in demand as Canadians look for safe getaways,Globe,
600,7/28/2020,U.S. senator introduces bill to curb Big Tech’s targeted ads,Globe,
601,7/28/2020,"Class of 2020 could lose thousands in potential earnings owing to COVID-19, study finds",Globe,
602,7/28/2020,Apply for a Postmedia Local Marketing Grant,Edmonton_Journal,
603,7/28/2020,Canada's largest life insurers face their worst profit pinch in years,National_Post,
604,7/28/2020,Five ways being a kind person can help your career,Globe,
605,7/28/2020,When is my employer obligated to pay severance if I’m temporarily laid off?,Globe,
606,7/28/2020,'Diabolical': Suppliers ‘absolutely furious’ at Walmart Canada plan to recoup investment through new fees,National_Post,
607,7/28/2020,Canadian winemakers face devil’s choice as Australia claims victory in fracas over excise duty exemption,National_Post,
608,7/28/2020,Preparedness is the only cure for investor anxiety in these uncertain times,National_Post,
609,7/28/2020,Tiny Canadian miner answers Elon Musk's plea for sustainable nickel,National_Post,
610,7/28/2020,CMHC eyeing 'new tools' as mortgage deferral cliff looms for borrowers,National_Post,
611,7/28/2020,Royal Bank of Canada cuts ties with WE Charity,National_Post,
612,7/28/2020,"After initial economic rebound, brace for a 'stall-out' phase that could last six to 18 months",National_Post,
613,7/28/2020,Scotiabank headquarters employees to work from home until 2021,National_Post,
614,7/28/2020,You are being watched: Insurers are ramping up surveillance to stamp out disability benefits fraud,National_Post,
615,7/28/2020,Tesla's Elon Musk is only weeks away from his next multibillion-dollar payout,National_Post,
616,7/28/2020,Visa beats estimates as quarterly profit falls 23%,Globe,
617,7/28/2020,"'The worst time to migrate': Bankers fleeing Hong Kong face grim job markets, high taxes in places like Canada",National_Post,
618,7/28/2020,"Moving target: As Ontario eyes U.S. fund disclosure model, SEC considers looser standard",National_Post,
619,7/28/2020,Oreo-maker Mondelez raises dividend as North America cushions emerging markets blow,Globe,
620,7/28/2020,"EBay beats second-quarter sales estimates, raises full-year outlook",Globe,
621,7/28/2020,"Starbucks shares rise 3% as same-store sales beat on delivery, drive-thru boost",Globe,
622,7/28/2020,Former CBS digital chief Jim Lanzone takes top job at Tinder,Globe,
623,7/28/2020,"Global passenger air traffic will not recover until 2024, a year later than expected, IATA says",Globe,
624,7/28/2020,Gucci owner Kering says outlook unclear as virus hammers sales,Globe,
625,7/28/2020,Pfizer says COVID-19 vaccine trial has 'robust immune response',Globe,
626,7/28/2020,Rite Aid facial-recognition rollout runs into trouble,Globe,
627,7/28/2020,Comparing Blade Runner's vision of 2019 to our reality,Globe,
628,7/28/2020,Tuesday’s analyst upgrades and downgrades,Globe,
629,7/28/2020,Transat A.T. Inc. delays closing $720-million takeover by Air Canada ,Globe,
630,7/28/2020,China and EU to speed up negotiation on investment agreement,Globe,
631,7/28/2020,Spain unlocks first tranche of €8-billion from new credit lines for companies,Globe,
632,7/28/2020,British Airways faces strike threat over job cuts,Globe,
633,7/31/2020,"Businesses are accelerating their tech investment timelines, IBM Canada head says",National_Post,https://financialpost.com
634,7/31/2020,Posthaste: Housing affordability is a worry but one analyst believes the scales may tip in favour of buyers as early as this summer,National_Post,https://financialpost.com
635,7/31/2020,Air Canada flags lower cash burn as a positive after second-straight quarterly loss,National_Post,https://financialpost.com
636,7/31/2020,"Howard Levitt: If Trudeau and Morneau were running a corporation, conflicts of interest in WE case would have led to their dismissal",National_Post,https://financialpost.com
637,7/31/2020,Commuting pension could buy this Ontario woman more flexibility in retirement,National_Post,https://financialpost.com
638,7/31/2020,Supplier fears intensify as major grocer group demands match of any discount given to Walmart,National_Post,https://financialpost.com
639,7/31/2020,"Ottawa to create EI-like benefit for gig, contract workers as CERB winds down",National_Post,https://financialpost.com/news/economy/ottawa-create-benefit-gig-contract-workers-cerb-winds-down/wcm/97f99020-9f4a-4775-bed3-817ba5e1b6ed/
640,7/31/2020,Telus reports 3.6% revenue increase as COVID-19 batters telecoms,National_Post,https://financialpost.com
641,7/31/2020,Long road to economic recovery begins in May,CboC,https://www.conferenceboard.ca/press/newsrelease/2020/07/31/long-road-to-economic-recovery-begins-in-may
642,7/31/2020,Growing Canada’s liquefied natural gas industry will create jobs and boost economy for decades,CboC,https://www.conferenceboard.ca/press/newsrelease/2020/07/27/growing-canada-s-liquefied-natural-gas-industry-will-create-jobs-and-boost-economy-for-decades
643,7/31/2020,"Retail sales rebound, but remain below pre-pandemic levels",CboC,https://www.conferenceboard.ca/press/newsrelease/2020/07/21/retail-sales-rebound-but-remain-below-pre-pandemic-levels
644,7/31/2020,Merchandise Exports and Imports Fall in September,CboC,https://www.conferenceboard.ca/press/trending-insights/new-insights/2019/11/05/merchandise-exports-and-imports-fall-in-september
645,7/31/2020,Lower Gasoline Prices Continue to Weigh on Inflation,CboC,https://www.conferenceboard.ca/press/trending-insights/new-insights/2019/09/18/lower-gasoline-prices-continue-to-weigh-on-inflation
646,7/31/2020,"Canadian economy bounces back in May, but 'normal' could be a long time coming",National_Post,https://financialpost.com
647,7/31/2020,TC Energy gets approval to move 30% more oil through Keystone XL amid pipeline challenges,Edmonton_Journal,na
648,7/31/2020,William Watson: Third time lucky for committees,National_Post,https://financialpost.com/opinion/william-watson-third-time-lucky-for-committees/wcm/0d486e25-a02f-4b2d-a5de-271fd1fc8da3/
649,7/31/2020,Inside Access: Student Performance in PISA 2018 - Nettlesome Questions for Canada,CD_Howe,https://www.cdhowe.org/essential-public-policy-events/inside-access-student-performance-pisa-2018-nettlesome-questions-canada
650,7/31/2020,Canada's tax regime is overdue for a reset — and now it might actually happen,National_Post,https://financialpost.com/news/economy/canadas-tax-regime-is-overdue-for-a-reset-and-now-it-might-actually-happen/wcm/90de2951-38d0-417b-adb8-417e63dc3337/
651,7/31/2020,"Legal fees can be a burden, but they're only tax deductible in certain circumstances",National_Post,https://financialpost.com/personal-finance/taxes/legal-fees-can-be-a-burden-but-theyre-only-tax-deductible-in-certain-circumstances/wcm/9b4d78c3-d7e7-48a9-bda1-578c56aa25e8/
652,7/31/2020,Six things to think about as a result of pandemic management,Globe,na
653,7/31/2020,"After a COVID-19 layoff, can this food science grad find an R&D job?",Globe,na
654,7/31/2020,Report on Small Business Newsletter: Ottawa extends small-business rent-relief program for another month,Globe,na
655,7/31/2020,Yamana says Canadian Malartic gold mine exceeded post-coronavirus production targets,Globe,na
656,7/31/2020,"Small businesses added $117-billion of new debt to battle COVID-19, CFIB says ",Globe,na
657,7/31/2020,Alstom deal for Bombardier’s rail business gets EU antitrust approval,Globe,na
658,7/31/2020,"Canadians want advertisers to thank front-line workers, new poll suggests ",Globe,na
659,7/31/2020,Companies rush to pivot advertising plans during COVID-19 pandemic,Globe,na
660,7/31/2020,Why you should factor in your real estate when you make all investment decisions,National_Post,https://financialpost.com/investing/investing-pro/why-you-should-factor-in-your-real-estate-when-you-make-all-investment-decisions/wcm/a8c7cf1d-5d6f-43dd-b886-c8986081f10d/
661,7/31/2020,What role does the Housing Market play in Sustaining Canada’s Financial Stability?,CD_Howe,https://www.cdhowe.org/essential-public-policy-events/what-role-does-housing-market-play-sustaining-canada%E2%80%99s-financial-stability
662,7/31/2020,Managing a Pension Fund Through a Crisis,CD_Howe,https://www.cdhowe.org/essential-public-policy-events/managing-pension-fund-through-crisis
663,7/31/2020,Canadian Crude Oil Prices Expected to Strengthen in 2020,Deloitte,/ca/en/pages/press-releases/articles/canadian-crude-oil-prices-expected-to-strengthen-in-2020.html
