,date,title,source,link
664,7/31/2020,"Nielsen, Headset and Deloitte announce a strategic alliance to provide data & insights to legal cannabis market in Canada",Deloitte,/ca/en/pages/press-releases/articles/announce-a-strategic-alliance.html
665,7/31/2020,"Employee experience, engagement, and learning key factors in driving social enterprise",Deloitte,/ca/en/pages/press-releases/articles/human-capital-trends-2019.html
666,7/31/2020,Anthony Viel to be next Chief Executive Officer of Deloitte Canada,Deloitte,/ca/en/pages/press-releases/articles/ceo-announcement.html
667,7/31/2020,"Shake, rattle, and stall: Preparedness and perseverance key in 2019",Deloitte,/ca/en/pages/press-releases/articles/dampened-economic-growth-looming-recession.html
668,7/31/2020,"Talent a Strength, but Taxes & Regulation are Stifling Growth",Deloitte,/ca/en/pages/press-releases/articles/canada-competitiveness-scorecard-press-release.html
669,7/31/2020,Deloitte estimates next round of cannabis legalization will create a new $2.7-billion market in Canada,Deloitte,/ca/en/pages/press-releases/articles/cannabis-legalization.html
670,7/31/2020,Extended production curbs should help Canadian oil prices,Deloitte,/ca/en/pages/press-releases/articles/oil-gas-price-forecast.html
671,7/31/2020,Deloitte welcomes Beelogix to further expand capabilities and leadership in SAP Digital Supply Chain Solutions,Deloitte,/ca/en/pages/press-releases/articles/deloitte-welcomes-beelogix-leadership-sap-supply-chain-management.html
672,7/31/2020,Deloitte and TruTrace Technologies Inc. form strategic alliance to improve cannabis quality control and safety for retailers and consumers,Deloitte,/ca/en/pages/press-releases/articles/deloitte-and-trutrace-technologies-inc-form-strategic-alliance-cannabis-quality-control.html
673,7/31/2020,"While online shopping continues to gain momentum this holiday season, Amazon expected to be the first stop",Deloitte,/ca/en/pages/press-releases/articles/2019-retail-holiday-study.html
674,7/31/2020,"Attracting the right talent, the rise of AI, and data protection at the forefront for Deloitte Technology Fast 50 winners",Deloitte,/ca/en/pages/press-releases/articles/deloitte-technology-fast-50-winners.html
675,7/31/2020,Deloitte research reveals significant return on investment for workplace mental health programs,Deloitte,/ca/en/pages/press-releases/articles/significant-roi-for-workplace-mental-health-programs.html
676,7/31/2020,Deloitte expands cannabis practice with Cannabis Compliance Inc.  acquisition,Deloitte,/ca/en/pages/press-releases/articles/cannabis-compliance-inc-acquisition.html
677,7/31/2020,Deloitte’s 2020 TMT Predictions forecasts greater accessibility to AI via new chips at the edge,Deloitte,/ca/en/pages/press-releases/articles/deloittes-2020-tmt-predictions-forecast.html
678,7/31/2020,Deloitte Global mining report explores key trends in 2020,Deloitte,/ca/en/pages/press-releases/articles/deloitte-global-mining-trends-2020.html
679,7/31/2020,Agnico Eagle CEO sees more M&A among world’s biggest gold miners amid record-high bullion prices,Globe,na
680,7/31/2020,Canada’s Oil & Gas Sector Faces Slow Recovery,Deloitte,/ca/en/pages/press-releases/articles/canada-oil-gas-sector-faces-slow-recovery.html
681,7/31/2020,The future of the mall: Deloitte sees a new kind of shopping experience for the post-pandemic world,Deloitte,/ca/en/pages/press-releases/articles/the-future-of-mall.html
682,7/31/2020,John Pecman – Can Antitrust Laws Assist with the Economic Recovery? ,CD_Howe,https://www.cdhowe.org/intelligence-memos/john-pecman-%E2%80%93-can-antitrust-laws-assist-economic-recovery
683,7/31/2020,Jon Johnson – US Court Insists on Strict Compliance with Section 232 Requirements,CD_Howe,https://www.cdhowe.org/intelligence-memos/jon-johnson-%E2%80%93-us-court-insists-strict-compliance-section-232-requirements
684,7/31/2020,Investir notre épargne en accord avec l’urgence climatique - La Presse Opinion,CD_Howe,https://www.cdhowe.org/expert-op-eds/investir-notre-%C3%A9pargne-en-accord-avec-l%E2%80%99urgence-climatique-la-presse-opinion
685,7/31/2020,Joanne De Laurentiis – The Case for Speedy Reform of the Self-Regulatory Organizations Function,CD_Howe,https://www.cdhowe.org/intelligence-memos/joanne-de-laurentiis-%E2%80%93-case-speedy-reform-self-regulatory-organizations-function
686,7/31/2020, Robert Siddall – Accounting Standards Need to Keep Pace with the Evolution of Public Sector Pension Plans,CD_Howe,https://www.cdhowe.org/intelligence-memos/robert-siddall-%E2%80%93-accounting-standards-need-keep-pace-evolution-public-sector
687,7/31/2020,Student Performance in PISA 2018: Nettlesome Questions for Canada,CD_Howe,https://www.cdhowe.org/public-policy-research/student-performance-pisa-2018-nettlesome-questions-canada
688,7/31/2020,"Kronick, Ambler, Robson – Welcome Clarity about Monetary Policy in Pandemic Times",CD_Howe,https://www.cdhowe.org/intelligence-memos/kronick-ambler-robson-%E2%80%93-welcome-clarity-about-monetary-policy-pandemic-times
689,7/31/2020,Recovery requires speedy foreign investment review - Financial Post Op-Ed,CD_Howe,https://www.cdhowe.org/expert-op-eds/recovery-requires-speedy-foreign-investment-review-financial-post-op-ed
690,7/31/2020,Battling Job Losses in Times of COVID,CD_Howe,https://www.cdhowe.org/graphic-intelligence/battling-job-losses-times-covid
691,7/31/2020,COVID-19: The C.D. Howe Institute’s Complete Policy Analysis,CD_Howe,https://www.cdhowe.org/public-policy-research/covid-19-cd-howe-institute%E2%80%99s-complete-policy-analysis
692,7/31/2020,S2 E12  – COVID-19: Catalyst for Change in Canadian Health,CD_Howe,https://www.cdhowe.org/s2-e12-%E2%80%93-covid-19-catalyst-change-canadian-health
693,7/31/2020, COVID-19 Economic Dashboard,CD_Howe,https://www.cdhowe.org/covid-19-economic-dashboard
694,7/31/2020,We should remember that consumers control the narrative ,Globe,na
695,7/31/2020,How public libraries play a vital role in restoring the economy,Globe,na
696,7/31/2020,Flight attendants union wants Ottawa – not the airlines – to make the rules about COVID-19 safety measures ,Globe,na
697,7/31/2020,"With deep pockets and long time horizons, China targets struggling Canadian gold companies",Globe,na
698,7/31/2020,Ottawa orders federal review of Alberta coal mine expansion,Globe,na
699,7/31/2020,"U.S. lawmakers appear ready to rein in Amazon, Google, Apple and Facebook",Globe,na
700,7/31/2020,Australia to make Facebook and Google pay for news content,Globe,na
701,7/31/2020,Thyssenkrupp closes $20.4-billion sale of elevator business,Globe,na
702,7/31/2020,‘Trying to strong-arm unrealized profit from homeowners would result in rampant injustices.’ Readers debate: Should Canada scrap the homeowner tax break?,Globe,na
703,7/31/2020,"Private equity deals plunge in second quarter as pandemic casts chill among buyers, sellers ",Globe,na
704,7/31/2020,Why I decided to take the word ‘chief’ out of my CEO title to respect Indigenous people,Globe,na
705,7/31/2020,"When I look in the mirror, I see George Floyd – and so do others",Globe,na
706,7/31/2020,It’s getting less lonely at the top: The sea change happening in the C-suite ,Globe,na
707,7/31/2020,Urgent vs. important: How to fight your urgency bias when completing tasks,Globe,na
708,7/31/2020,The week’s most oversold and overbought stocks on the TSX,Globe,na
709,7/31/2020,Friday’s analyst upgrades and downgrades,Globe,na
710,7/31/2020,European airline and airport executives press Canada for safe ‘restoration of travel’ ,Globe,na
711,7/31/2020,EU clears Alstom $11.8-billion takeover of Bombardier’s train business,Globe,na
712,7/31/2020,Air Canada posts $1.7-billion quarterly loss as revenues plunge 89%,Globe,na
713,7/31/2020,Canada’s rail traffic tells a different story about the economic rebound,Globe,na
714,7/31/2020,"At midday: TSX falls on dismal second-quarter GDP estimate, poor earnings",Globe,na
715,7/31/2020,Shaw Communications launches Shaw Mobile wireless service,Calgary_Herald,na
716,7/31/2020,"Exxon, Chevron Earnings Gutted by Virus-Driven Demand Slump",Calgary_Herald,na
717,7/31/2020,Canadian economy grew 4.5% in May,Calgary_Herald,na
718,7/31/2020,Varcoe: Province unveils new plan to tackle old wells and environmental liabilities,Edmonton_Journal,na
719,7/31/2020,"Shaw Communications launches Shaw Mobile, brand-new wireless service",Edmonton_Journal,na
720,7/31/2020,Rent relief program has been a bust for many small businesses slammed by COVID,Edmonton_Journal,na
721,7/31/2020,Canadian financial institutions join data exchange to speed up development of open banking,Globe,na
722,7/31/2020,Varcoe: A sliver of good news in a stormy period — more pipeline capacity on Keystone,Edmonton_Journal,na
723,7/31/2020,How long will your kids cost you money?,Globe,na
724,7/31/2020,"GM partners with EVgo to add 2,700 new fast chargers in U.S.",Globe,na
725,7/31/2020,Caisse hires Canada’s retiring UN ambassador as executive in charge of global portfolio,Globe,na
726,7/31/2020,"Tesla demand has been resilient during coronavirus pandemic, Musk says",Globe,na
727,7/31/2020,Ottawa extends small business rent-relief program through August ,Globe,na
728,7/31/2020,SNC-Lavalin restructuring resources business to return to profitability in 2021,Globe,na
729,7/31/2020,"Canada’s GDP jumped 4.5 per cent in May, but likely fell 12 per cent in second quarter due to COVID-19",Globe,na
730,7/31/2020,U.S. coronavirus response poses risk to global economic recovery,Globe,na
731,7/31/2020,Algonquin Power & Utilities receives big boost to five-year growth plan,Globe,na
732,7/31/2020,Home buying and mortgage rates in the wake of COVID-19,Globe,na
733,7/31/2020,"Australia to force Facebook, Google to pay for news",Globe,na
734,7/31/2020,Searching for microplastics within the human body,Globe,na
735,7/31/2020,Video: Drawing Conclusions: How much does it cost to break a mortgage?,Globe,na
736,7/31/2020,Rob Carrick's personal finance tips amidst coronavirus,Globe,na
737,7/31/2020,The nuances of CERB are becoming clearer with time,Globe,na
738,7/31/2020,Laura’s Shoppe obtains creditor protection as Canadian retailers struggle with the pandemic,Globe,na
739,7/31/2020,Other grocers follow Walmart’s lead signalling they may ask for new fees from suppliers,Globe,na
740,7/31/2020,Telus reports 39% drop in profit last quarter as store closures and reduced roaming hit the bottom line,Globe,na
741,7/31/2020,Pinterest shares soar as pandemic lockdowns lead to increased usage,Globe,na
742,7/31/2020,U.S. set to unveil crackdown on China’s ByteDance over TikTok: sources,Globe,na
743,7/31/2020,Canadian GDP likely fell by record 12% in second quarter due to COVID-19,Globe,na
744,7/31/2020,U.S. consumer spending rises for second straight month in June,Globe,na
745,7/31/2020,Canadian dollar stays on track for best win streak in 6 years as it gains in July,Globe,na
746,7/31/2020,Exxon posts second-straight loss on plunging oil demand and prices,Globe,na
747,7/31/2020,Imperial Oil posts $526-million loss on coronavirus-led energy slump,Globe,na
748,7/31/2020,"BC Hydro says Site C dam project now faces delays, rising costs due to COVID-19 pandemic",Globe,na
749,7/31/2020,Mastercard beats profit estimates as lower costs cushion blow to consumer spending,Globe,na
750,7/31/2020,Canada’s insurers set for double-digit profit drops amid COVID-19,Globe,na
751,7/31/2020,Streetwise newsletter: Canada’s insurers set for double-digit profit drops amid COVID-19,Globe,na
752,7/31/2020,Economic slowdown hits the alternative lending business,Globe,na
753,7/31/2020,Canadian banks face rising loan losses as government COVID-19 support programs taper off,Globe,na
754,7/31/2020,Ontario real estate investors allege developers diverted millions for personal use,Globe,na
755,7/31/2020,Canada’s Best Managed Companies investing in technology and talent for future success,Deloitte,/ca/en/pages/press-releases/articles/best-managed-companies-invest-technology-talent-future-success.html
